{
  "contract_family": "source-session-handoff",
  "contract_version": "v1.0",
  "profile": "oauth2-authorization-code-pkce-s256-v1",
  "status": "issued",
  "token_type": "Bearer",
  "assertion_format": "compact-jws-authenticated-context-v1",
  "assertion": "eyJhbGciOiJFZERTQSIsImtpZCI6InNvdXJjZS1rZXktcGxhY2Vob2xkZXItMDAxIn0.eyJjb250cmFjdF9mYW1pbHkiOiJzb3VyY2Utc2Vzc2lvbi1oYW5kb2ZmIiwiY29udHJhY3RfdmVyc2lvbiI6InYxLjAiLCJwcm9maWxlIjoib2F1dGgyLWF1dGhvcml6YXRpb24tY29kZS1wa2NlLXMyNTYtdjEiLCJwdXJwb3NlIjoidXNlci1lbnRyeS1zZXNzaW9uLWhhbmRvZmYiLCJoYW5kb2ZmX3JlZiI6ImhhbmRvZmYtcGxhY2Vob2xkZXItMDAxIiwidHJhbnNhY3Rpb25fcmVmIjoidHJhbnNhY3Rpb24tcGxhY2Vob2xkZXItMDAxIiwiY29ycmVsYXRpb25fcmVmIjoiY29ycmVsYXRpb24tcGxhY2Vob2xkZXItMDAxIiwiaXNzdWVyIjoiaXNzdWVyLXBsYWNlaG9sZGVyLTAwMSIsImF1ZGllbmNlIjoicmVjZWl2ZXItcGxhY2Vob2xkZXItMDAxIiwicmVjZWl2ZXJfcmVmIjoicmVjZWl2ZXItcGxhY2Vob2xkZXItMDAxIiwiY2xpZW50X3JlZiI6ImNsaWVudC1wbGFjZWhvbGRlci0wMDEiLCJzdWJqZWN0X3JlZiI6InN1YmplY3QtcGxhY2Vob2xkZXItMDAxIiwic291cmNlX3Nlc3Npb25fcmVmIjoic291cmNlLXNlc3Npb24tcGxhY2Vob2xkZXItMDAxIiwic291cmNlX2NvbnRleHRfcmVmIjoic291cmNlLWNvbnRleHQtcGxhY2Vob2xkZXItMDAxIiwib3JnYW5pc2F0aW9uX3JlZiI6Im9yZ2FuaXNhdGlvbi1wbGFjZWhvbGRlci0wMDEiLCJhY2NvdW50X3JlZiI6ImFjY291bnQtcGxhY2Vob2xkZXItMDAxIiwicmVjb3JkX3Njb3BlX3JlZnMiOlsicmVjb3JkLXNjb3BlLXBsYWNlaG9sZGVyLTAwMSJdLCJzb3VyY2Vfcm9sZV9yZWYiOiJzb3VyY2Utcm9sZS1wbGFjZWhvbGRlci0wMDEiLCJzb3VyY2VfcGVybWlzc2lvbl9yZWZzIjpbInNvdXJjZS1wZXJtaXNzaW9uLXBsYWNlaG9sZGVyLTAwMSJdLCJkZXN0aW5hdGlvbl91cmkiOiJodHRwczovL3JlY2VpdmVyLmV4YW1wbGUvc2Vzc2lvbi1oYW5kb2ZmL2NhbGxiYWNrIiwiaXNzdWVkX2F0IjoiMjAyNi0wOC0xNVQwMDowMDoyMFoiLCJleHBpcmVzX2F0IjoiMjAyNi0wOC0xNVQwMDowNDoyMFoifQ.4RNkaZ8YxYv1WwEK3STQ4q6jGsxOxsAlcrVSYI3Z9XRigPDr6MLuEmTG4_XUyYclV_1beWSh-83ww9975_VDBw",
  "expires_in": 240
}
